id,text,Category,source
745,Areas of expertise  Big Data Ecosystems HadoopHDFS MapReduce Hive Pig Sqoop HBase Oozie Spark Pyspark HUE and having knowledge on cassandra  Programming Languages Python Core Java and have an idea on Scala  Databases Oracle 10g MySQL Sqlserver NoSQL  HBase Cassandra  Tools Eclipse Toad FTP Tectia Putty Autosys Anaconda Jupyter notebool and Devops  RTC RLM  Scripting Languages JSP  Platforms Windows UnixEducation Details  MTech ITDBS BTech CSE  SRM UniversitySoftware Engineer Software Engineer  Larsen and ToubroSkill Details Company Details company  Larsen and Toubrodescription  Worked as a Software Engineer in Technosoft Corporation Chennai from Aug 2015 to sep 2016company  Current Projectdescription  Duration September 2016 to Till dateVendor Citi bankDescriptionCitibanks Citi AntiMoney Laundering AML Transaction Monitoring TM program is a future state solution and a rulesbased system for transaction monitoring of ICGMarkets businessRoles and Responesbilities Building and providing domain knowledge for Anti Money Laundering among team members The layered architecture has Data Warehouse and Workspace layers which are used by Business Analysts Actively involved in designing of starschema model involving various Dimensions and Fact tables Designed SCD2 for maintaining history of the DIM data Developing Hive Queries for mapping data between different layers of architecture and its usage in Oozie Workflows Integration with Data Quality and Reconciliation Module Regression and Integration testing of solution for any issues in integration with other modules and effectively testing the data flow from layertolayer Transaction monitoring system development to generate Alerts for the suspicious and fraudulent transactions based on requirements provide by BAs Developing spark Jobs for various business rules Learning Machine Learning which will be used further in the project for developing an effective model for Fraud detection for Anti Money Laundering system Scheduling Jobs using Autosys tool Deployment and Code Management using RTC and RLMRelease Lifecycle ManagementHadoop Developer  Current Project PRTS  RANEnvironment Hadoop 2x HDFS Yarn Hive Sqoop HBase Tez Tableau Sqlserver TeradataCluster Size 96 Node ClusterDistribution Horton works  HDP23company  Alcatel lucentdescription  1X and  Ruckus WirelessDescriptionThe scope of this project is to maintain and store the operational and parameters data collected from the multiple vendors networks by the mediation team into the OMS data store and make it available for RF engineers to boost the network performanceResponsibilities Working with Hadoop Distributed File System Involved in importing data from MySQL to HDFS using SQOOP Involved in creating Hive tables loading with data and writing hive queries which will run  on top of  Tez execution Engine Involved in Preparing Test cases Document Involved in Integrating Hive and HBase to store the operational data Monitoring the Jobs through Ooziecompany  Current Projectdescription  Anti  Money launderingEnvironment Hadoop 2x HDFS Yarn Hive Oozie Spark Unix Autosys Python RTC RLM ETL Framwe workCluster Size 56 Node ClusterDistribution Cloudera 5914,Hadoop,tech_resumes1_csv
775,Technical Skills Programming Languages C C Java Net J2EE HTML5 CSS MapReduce Scripting Languages Javascript Python Databases Oracle PLSQL MYSQL IBM DB2 ToolsIBM Rational Rose R Weka Operating Systems Windows XP Vista UNIX Windows 7 Red Hat 7Education Details January 2015 BE  Pimpri Chinchwad MAHARASHTRA IN Pimpri Chinchwad College of EngineeringJanuary 2012 Diploma MSBTE  Dnyanganaga Polytechnic SSC   New English School TakaliHadoopBig Data Developer HadoopBig Data Developer  British TelecomSkill Details APACHE HADOOP MAPREDUCE Exprience  37 monthsMapReduce Exprience  37 monthsMAPREDUCE Exprience  37 monthsJAVA Exprience  32 monthsNET Exprience  6 monthsCompany Details company  British Telecomdescription  Project British Telecom project UKResponsibilities Working on HDFS MapReduce Hive Spark Scala Sqoop Kerberos etc technologies Implemented various data mining algorithms on Spark like Kmeans clustering Random forest Nave bayes etc A knowledge of installing configuring maintaining and securing Hadoopcompany  DXC technologydescription  HPE legacy Bangalore Worked on Hadoop  Java programming Worked on Azure and AWS EMR services Worked on HDInsight Hadoop cluster Design develop document and architect Hadoop applications Develop MapReduce coding that works seamlessly on Hadoop clusters Analyzing and processing the large data sets on HDFS An analytical bent of mind and ability to learnunlearnrelearn surely comes in handy,Hadoop,tech_resumes1_csv
366,Education Details  BE IT   pjlceJava Developer Java DeveloperSkill Details c Exprience  Less than 1 year monthsc Exprience  Less than 1 year monthsJAVA Exprience  Less than 1 year monthsDS Exprience  Less than 1 year monthsJdbc Exprience  24 monthsHibernate Exprience  Less than 1 year monthsJava J2Ee Exprience  Less than 1 year monthsJavascript Exprience  6 monthsJQuery Exprience  6 monthsAjax Exprience  6 monthsCompany Details company  Almighty tech pvt ltd nagpurdescription  1 As a Java Developer ORGANISATION Almighty tech pvt ltd Nagpur DESIGNATION Java Developer DURATION From 1st jan 2018 Notice Period 15 daysJOB RESPONSIBILITIES Resolve Bugs Develop project as per user requirementKNOWLEDGE ABOUT Programming language C C DS JavaSwing JDBC J2EE java scriptjqueryAjax Ms office Excel,Java Developer,tech_resumes1_csv
347,Education Details August 2010 to May 2017 BE Electronics  Communication Jabalpur Madhya Pradesh Takshshila institute of technologyJava developer Skill Details Java Javascript Exprience  6 monthsCompany Details company  Wab It Softwere Pvt  Ltddescription  Jr Java Developer,Java Developer,tech_resumes1_csv
374,Skills  Language Java  Operating System Windows Linux CentOS 66  Databases Oracle My SQL and Derby Embedded DB  IDE Eclipse Oxygen  Tools SonarQube Putty Responsibilitis  Participated in requirements gathering and design development meetings  Reviewed code and debugged errors to improve performance  Coordinated with systems partners to finalize designs and confirm requirements  Consistently met deadlines and requirements for all production work orders  Collaborated with other developers to identify and alleviate the number of bugs in the software and provided maintenance and development of bug fixes and patch sets for existing applications Education Details  Bachelor of Engineering  Computer   Savitribai Phule Pune UniversityJava Developer Java Developer  Aurus Tech Pvt LtdSkill Details JAVA Exprience  32 monthsLINUX Exprience  6 monthsAdavance Java Exprience  Less than 1 year monthsDerby Exprience  Less than 1 year monthsOracle Exprience  Less than 1 year monthsCompany Details company  Aurus Tech Pvt Ltddescription  Having 2 years of experience in working with a Payment Gateway Solutions provider with Core Java Hardworking Java Developer enthusiastic about working with multicultural teamscompany  Aurus Tech Pvt Ltddescription   Participated in requirements gathering and design development meetings Reviewed code and debugged errors to improve performance Coordinated with systems partners to finalize designs and confirm requirements Consistently met deadlines and requirements for all production work orders Collaborated with other developers to identify and alleviate the number of bugs in the software and provided continued maintenance and development of bug fixes and patch sets for existing applications,Java Developer,tech_resumes1_csv
349,TECHNICAL SKILLS Skills Java SQL PLSQL C C BootStrap JSP Ext JS Operating Systems Windows Tools Toad Eclipse SoapBox Postman Databases Oracle MSSQL MSAccess MSExcelEducation Details January 2017 BE Computer Technology Gondia MAHARASHTRA IN Manoharbhai Patel Institute of Engineering and Technology HSC  Gondia MAHARASHTRA IN SMP Science CollegeJava Developer Java Developer  Xoriant Solutions Pvt LtdSkill Details Company Details company  Xoriant Solutions Pvt Ltddescription  PunePeriod                Sept 2017 to till dateRole                  Java DeveloperDescription           ResRent is a team responsible for the development of variousmodules for Hertz They are responsible for the development of screens in the portfolios they look after and act as aprimary control function developing webservices to ensure it canbe hit by XML and JSON We build various modules which areinbuilt in Hertz to provide interfaces for end users in their tasksTools                 Eclipse TOAD SoapBox PostmanResponsibilities       Develop module from Backend to Middleware to Frontend Bugs fixing and proactive developing of enhancements Resolve Application incidents within defined UCs  creatingdifferent Task ticket as well Debug and provide solution for workflow Resolving DB issues and providing technical support to BAs Keeping track of deployments and effect of same on ongoingjobs Contribution towards automation of daily activities and processbased organization Ontime withinbudget delivery meeting customers qualityexpectations Maintain knowledge base of domain known defects and issuesprocesses and development techniquescompany  Xoriant Solutions Pvt Ltddescription  Strong communication collaboration  team building skills with proficiency at graspingnew technical concepts quickly and utilize the same in a productive manner Experience in development in Web application Resolve project related issues in minimal time Able to communicate effectively with multifunctional teams programmers and technical staff at all levels Good knowledge of Java Sql Ext JS JSP XML Web services Good interpersonal  analytical skills with proven abilities in resolving the complexsoftware issue,Java Developer,tech_resumes1_csv
398,Computer Skills Languages And Script JSP Servlet HTML CSS Java Script Jquery Ajax Spring Hibernate Operating System Microsoft Windows 2003XPVista78 Databases My SQL Concepts OOPS Core java Advance java Development Tool Eclipse Net beans IDE Web Server Apache Tomcat 70Education Details January 2007 HSC  Amravati Maharashtra VidyaBharati collegeJanuary 2005 SSC  Amravati Maharashtra Holy Cross English SchoolJava Developer Java Developer  Kunal IT Services Pvt LtdSkill Details ECLIPSE Exprience  Less than 1 year monthsJAVA Exprience  14 monthsHIBERNATE Exprience  Less than 1 year monthsSPRING Exprience  Less than 1 year monthsjQuery Exprience  Less than 1 year monthsCompany Details company  Kunal IT Services Pvt Ltddescription  Currently Working As Java Developer In Winsol Solution Pvt Ltd From 1 July 2017 To Till DateExperience Of  2 Yrs As A Java Developer In Kunal IT Services Pvt Ltd,Java Developer,tech_resumes1_csv
672,Technical Expertise  Cisco ASA Checkpoint firewall GAIA Splat Palo Alto firewalls  Firewall management tools Cisco security management CSM Checkpoint Smart center Palo Alto Panorama  F5 load balancer LTM  Networking Hands on Cisco Router and Cisco Switches  Security Management  Event Management RSAEnvision 41  Ticketing tools  BMC Remedy Servicenow Other Technologies Software languages Python VB ScriptingEducation Details January 2006 to January 2010 Bachelor of Engineering Information Technology Mumbai Maharashtra Mumbai UniversitySenior Network security Analyst Senior Network security Analyst  AccentureSkill Details FIREWALLS Exprience  97 monthsCISCO Exprience  89 monthsSECURITY Exprience  72 monthsFIREWALL Exprience  45 monthsCHECKPOINT Exprience  44 monthsCompany Details company  Accenturedescription  Install configure upgrades and troubleshoot Cisco ASA firewalls  5500X  which includes Single and multicontext firewalls F5 LTM  configuration VIP pools SSL offloading certificate renewals Code upgrade and troubleshoot issues Pulse secure Juniper  management includes creating Roles Realm polices   for remote access reverse proxy and Code upgrade PAC file configuration Preparing design documents HLD LLD IP Schema and Configuration of all network devices as per customer requirements in data center environment Incident Management Change management Problem Management  ITIL process Key projects Worked on resiliency project like firewall policy lockdown Software code upgrade on all firewalls and load balancers End to end coordination for firewall deployment Tools Cisco security manager 4xcompany  Zensar Technologiesdescription  Install Upgrades Checkpoint firewalls GAIA R75 R77 and policy deployment Troubleshoot checkpoint firewalls Palo alto firewall and Cisco ASAs for multiple sites belongs to US Canada and EMEA region Configure upgrades troubleshoot Cisco Routers  Cisco 29xx 28xx 19xx and Cisco switches 2960 3560 and Cisco Meraki AP in Meraki Cloud F5 LTM configuration and troubleshooting the operational issuescompany  Infosys Technologiesdescription  Responsibilities Install configure upgrade and troubleshoot checkpoint firewalls Cisco Routers Switches Configure monitor and troubleshoot issues within organization LAN WAN and customerConnectivity networks Interface with vendors and service providers ensuring that hardware or software problems were dealt with efficiently and effectively with minimal downtimecompany  HCLComnetdescription  Responsibilities Event moitoring and administration of RSA enVision 41 SIEM Proficient in researching traffic patterns to identify falsepositives andor malicious traffic within IDS IPS scanners Qualis and firewalls Experience in writing correlation rules parsers  developing UDS for unsupported device logs analyze a large volume of security events while maintaining a high quality of analysis Change Configuration Management exposurecompany  Wipro Technologiesdescription  Administrator Manage and troubleshoot multivendor Network Infrastructure consisting of Cisco Juniper Platforms  Cisco Router 3845 Cisco stackwise switches 3750E and 2960 access switch Cisco 4500 chassis Cisco 555020 ASA firewalls Juniper SA 6500 SSL VPN Provisioning and troubleshooting access issues related to RSA and Entrust 2FA User Accounts Taking all network and security devices configuration back up on weekly and monthly basis,Network Security Engineer,tech_resumes1_csv
661,Communication Skills My writing skills in English is very good and I am certainly a clear speaker Being comfortable speaking in front of an audience I can easily facilitate meetings and brainstorming sessions Interpersonal Skills As a friendly polite person with positive attitude I work well with others and deal with difficult situations in a careful and considerate manner Learning Skills I have a high capacity for learning pick up new skills and ideas quickly and generally thrive on challenges Enthusiasm and creativity give me an edge on difficult projects Problem Solving Skills My analytical skills help me troubleshoot problems and uncover root causes I am creative and tenaciousEducation Details July 2012 to April 2015 Bachelor of Science INFORMATION TECHNOLOGY Mumbai Maharashtra Akbar Peerbhoy College of Comm  Eco University of MumbaiJune 2008 to April 2010   Jaunpur Uttar Pradesh Janta Inter College JaunpurMay 2006 to April 2008   Jaunpur Uttar Pradesh Inter College JaunpurNetwork Security Engineer Skill Details Network Security Network Administration Firewall and VPN Configuration Routing and Switching Exprience  24 monthsCompany Details company  Karvy Innotech LTDdescription  Managing network of Mahindra  Mahindra Financial services limited both internal and at PAN India levelInstallation setup  configuration troubleshooting Tuning diagnostics and maintenance of IT security related EquipmentMaintaining all network devices such as Routers Switches Firewall WiFi DevicesTroubleshoot performance and availability issues on security devices such as firewalls UTM Content Filtering solutions and Handling daily calls related to network and network securityManage and administer the VPN connectivity with organizations clientsImplement Policy Changes Configure URL filtering  security policies onUTM appliances Monitor alerts received from the monitoring systems and take appropriate action based on the defined processesFollow the SLAs and procedures already defined for security device managementCoordinating with ISPs like TATA Airtel Reliance Vodafone Sify Tikona  HCL Comnet for all WAN related issuesConfiguration and Troubleshooting of Site to Site IPSEC VPN between HO and Remote BranchesMaintaining inventory on monthly basis of all network devicesLAN Connectivity issues Crimping Rack Mounting Reporting to CISO of Mahindra Finance for all network related queries and solutions,Network Security Engineer,tech_resumes1_csv
662,Technical Expertise  Cisco ASA Checkpoint firewall GAIA Splat Palo Alto firewalls  Firewall management tools Cisco security management CSM Checkpoint Smart center Palo Alto Panorama  F5 load balancer LTM  Networking Hands on Cisco Router and Cisco Switches  Security Management  Event Management RSAEnvision 41  Ticketing tools  BMC Remedy Servicenow Other Technologies Software languages Python VB ScriptingEducation Details January 2006 to January 2010 Bachelor of Engineering Information Technology Mumbai Maharashtra Mumbai UniversitySenior Network security Analyst Senior Network security Analyst  AccentureSkill Details FIREWALLS Exprience  97 monthsCISCO Exprience  89 monthsSECURITY Exprience  72 monthsFIREWALL Exprience  45 monthsCHECKPOINT Exprience  44 monthsCompany Details company  Accenturedescription  Install configure upgrades and troubleshoot Cisco ASA firewalls  5500X  which includes Single and multicontext firewalls F5 LTM  configuration VIP pools SSL offloading certificate renewals Code upgrade and troubleshoot issues Pulse secure Juniper  management includes creating Roles Realm polices   for remote access reverse proxy and Code upgrade PAC file configuration Preparing design documents HLD LLD IP Schema and Configuration of all network devices as per customer requirements in data center environment Incident Management Change management Problem Management  ITIL process Key projects Worked on resiliency project like firewall policy lockdown Software code upgrade on all firewalls and load balancers End to end coordination for firewall deployment Tools Cisco security manager 4xcompany  Zensar Technologiesdescription  Install Upgrades Checkpoint firewalls GAIA R75 R77 and policy deployment Troubleshoot checkpoint firewalls Palo alto firewall and Cisco ASAs for multiple sites belongs to US Canada and EMEA region Configure upgrades troubleshoot Cisco Routers  Cisco 29xx 28xx 19xx and Cisco switches 2960 3560 and Cisco Meraki AP in Meraki Cloud F5 LTM configuration and troubleshooting the operational issuescompany  Infosys Technologiesdescription  Responsibilities Install configure upgrade and troubleshoot checkpoint firewalls Cisco Routers Switches Configure monitor and troubleshoot issues within organization LAN WAN and customerConnectivity networks Interface with vendors and service providers ensuring that hardware or software problems were dealt with efficiently and effectively with minimal downtimecompany  HCLComnetdescription  Responsibilities Event moitoring and administration of RSA enVision 41 SIEM Proficient in researching traffic patterns to identify falsepositives andor malicious traffic within IDS IPS scanners Qualis and firewalls Experience in writing correlation rules parsers  developing UDS for unsupported device logs analyze a large volume of security events while maintaining a high quality of analysis Change Configuration Management exposurecompany  Wipro Technologiesdescription  Administrator Manage and troubleshoot multivendor Network Infrastructure consisting of Cisco Juniper Platforms  Cisco Router 3845 Cisco stackwise switches 3750E and 2960 access switch Cisco 4500 chassis Cisco 555020 ASA firewalls Juniper SA 6500 SSL VPN Provisioning and troubleshooting access issues related to RSA and Entrust 2FA User Accounts Taking all network and security devices configuration back up on weekly and monthly basis,Network Security Engineer,tech_resumes1_csv
656,Communication Skills My writing skills in English is very good and I am certainly a clear speaker Being comfortable speaking in front of an audience I can easily facilitate meetings and brainstorming sessions Interpersonal Skills As a friendly polite person with positive attitude I work well with others and deal with difficult situations in a careful and considerate manner Learning Skills I have a high capacity for learning pick up new skills and ideas quickly and generally thrive on challenges Enthusiasm and creativity give me an edge on difficult projects Problem Solving Skills My analytical skills help me troubleshoot problems and uncover root causes I am creative and tenaciousEducation Details July 2012 to April 2015 Bachelor of Science INFORMATION TECHNOLOGY Mumbai Maharashtra Akbar Peerbhoy College of Comm  Eco University of MumbaiJune 2008 to April 2010   Jaunpur Uttar Pradesh Janta Inter College JaunpurMay 2006 to April 2008   Jaunpur Uttar Pradesh Inter College JaunpurNetwork Security Engineer Skill Details Network Security Network Administration Firewall and VPN Configuration Routing and Switching Exprience  24 monthsCompany Details company  Karvy Innotech LTDdescription  Managing network of Mahindra  Mahindra Financial services limited both internal and at PAN India levelInstallation setup  configuration troubleshooting Tuning diagnostics and maintenance of IT security related EquipmentMaintaining all network devices such as Routers Switches Firewall WiFi DevicesTroubleshoot performance and availability issues on security devices such as firewalls UTM Content Filtering solutions and Handling daily calls related to network and network securityManage and administer the VPN connectivity with organizations clientsImplement Policy Changes Configure URL filtering  security policies onUTM appliances Monitor alerts received from the monitoring systems and take appropriate action based on the defined processesFollow the SLAs and procedures already defined for security device managementCoordinating with ISPs like TATA Airtel Reliance Vodafone Sify Tikona  HCL Comnet for all WAN related issuesConfiguration and Troubleshooting of Site to Site IPSEC VPN between HO and Remote BranchesMaintaining inventory on monthly basis of all network devicesLAN Connectivity issues Crimping Rack Mounting Reporting to CISO of Mahindra Finance for all network related queries and solutions,Network Security Engineer,tech_resumes1_csv
674,Skill Set  Experience in Implementing and troubleshooting network security solutions  Planning and Implementation knowledge of multi vendor firewalls Cisco ASA Checkpoint Upto R80 JuniperNetscreen Fortinet FWSM  Familiarity with the latest hardware and network security technologies  Excellent analytical and problem solving skills  Skilled in analyzing and monitoring network security solutions using a variety of Monitoring solutions Zenoss Solarwinds Cisco Prime  Work Experience on multi client data center environments  Knowledge and Work experience on Firewall IOS Upgrade projects  Configuration of F5 load balancers SSL certificate updates IRule F5 upgrades  Configuration of Cisco Routers  series 1800 1900 2500 2600 2800 3600 Nexus  5k 7k  Configuration of Cisco switches series  2960 3750 catalyst 4500 3600  Working knowledge of Bluecoat Proxy  Knowledge of ITIL processEducation Details September 2006 to August 2011 Bachelor of Engineering BE Electronics Pune Maharashtra AISSMS College of Engineering University of PuneJuly 2004 to February 2006 Higher Secondary Certificate Science Pune Maharashtra Sinhgad College University Of PuneJune 2003 to March 2004 secondary school certificate SSC science Pune Maharashtra MES Boys High School Maharashtra PuneNetwork and Security Engineer Network and Security Engineer  CapitaSkill Details Network Security Exprience  72 monthsCHECKPOINT Exprience  72 monthsCISCO Exprience  72 monthsCISCO ASA Exprience  72 monthsCisco routing and switching Exprience  60 monthsLoadbalncing F5 Exprience  60 monthssecurity Exprience  Less than 1 year monthsCisco Exprience  Less than 1 year monthsVPN Exprience  Less than 1 year monthsLAN Exprience  Less than 1 year monthsNetworking Exprience  Less than 1 year monthsCompany Details company  Capitadescription  Work on Client Shared Network and Security infra Plan Implement and troubleshoot customer requests Monitor Datacenter infra 247 Work as On call engineer for weekends to provide Out of office supportcompany  Capgemini India Pvt Ltddescription  Part of UK India NOC Work on Client dedicated infra Undergo Client infra handover sessions to streamline client on boarding process  Act as mentor for juniors Attend Weekly CAAB calls to represent critical Changescompany  Sungard Availability Servicesdescription  Plan Troubleshoot and Implement Client network requests Project Work  Internet BW upgradeDowngrade Decommission DR test planning and implementation Setting up L3VPNs for customerscompany  SunGard Software Solutionsdescription  Maintain Client Documentation Work on datacenter Remediation Project DNS record ManagementSunGard Availability Services,Network Security Engineer,tech_resumes1_csv
