id,text,Category,source
403,Education Details  BE Computer Science Mumbai Maharashtra Mumbai University HSC  Mumbai Maharashtra Maharashtra State Board SSC  Mumbai Maharashtra Maharashtra State BoardBusiness Analyst Business Analyst  Fino Payments BankSkill Details Company Details company  Fino Payments Bankdescription  Key Role   Indepth requirement and input gatheringResponsibilities and Achievements Conducted indepth requirement and input gathering from all concerned stakeholders Business SMEs Technical Architect and Business Architect to create artifacts like Business Requirement Document BRD to arrive at functional requirements for development team Created Functional Specification Document FSD highlighting the technical implementation and the use cases Led the Merchant Commission Module project from endtoend and coordinated for CUG and Live Designed the Account Opening Process flow endtoend during the time when bank was going Live SPOC for all the configurations both account level and customer level in production Led the Cash Controlling Processes for the field users as per the requirement from the business team Design and build proof of concepts to validate the viability of alternate approaches and determine optimum choice Involved in Process Design for development of the products Performed Functional Testing of the entire system and provided support during UAT by preparing UAT test cases performing UAT tests to onboard new processes as BAU Worked with the development teams in arriving at detailed technofunctional specifications participate in FeasibilityAnalysis Conducting twice a week meetings with the vendor to discuss the status of CRs and to resolve technical queriescompany  Fino Paytech Pvt Ltddescription  Key Role   Requirement gathering Development TestingResponsibilities and Achievements Requirement gathering preparation of traceability matrix preparation and execution of use cases developing of test plans based on requirements for Airtel Zambia National Partner Project Led the employee profile creation maintenance of employee details in the database Preparation of work flow endtoend development and testing of the module Designed the work flow process of the CAPA Corrective Action Preventive Analysis module to maintain the audit findings raised by the internal audit team Designed the Expense Management module and automated it for endtoend inhouse expense flow Designed the PMO tool Parivartan used for tracking the projects endtoend,Business Analyst,tech_resumes1_csv
14,Education Details  MCA   YMCAUST  Faridabad  HaryanaData Science internship Skill Details Data Structure Exprience  Less than 1 year monthsC Exprience  Less than 1 year monthsData Analysis Exprience  Less than 1 year monthsPython Exprience  Less than 1 year monthsCore Java Exprience  Less than 1 year monthsDatabase Management Exprience  Less than 1 year monthsCompany Details company  Itechpowerdescription,Data Science,tech_resumes1_csv
3,Skills  R  Python  SAP HANA  Tableau  SAP HANA SQL  SAP HANA PAL  MS SQL  SAP Lumira  C  Linear Programming  Data Modelling  Advance Analytics  SCM Analytics  Retail Analytics Social Media Analytics  NLP Education Details January 2017 to January 2018 PGDM Business Analytics  Great Lakes Institute of Management  Illinois Institute of TechnologyJanuary 2013 Bachelor of Engineering Electronics and Communication Bengaluru Karnataka New Horizon College of Engineering Bangalore Visvesvaraya Technological UniversityData Science Consultant Consultant  Deloitte USISkill Details LINEAR PROGRAMMING Exprience  6 monthsRETAIL Exprience  6 monthsRETAIL MARKETING Exprience  6 monthsSCM Exprience  6 monthsSQL Exprience  Less than 1 year monthsDeep Learning Exprience  Less than 1 year monthsMachine learning Exprience  Less than 1 year monthsPython Exprience  Less than 1 year monthsR Exprience  Less than 1 year monthsCompany Details company  Deloitte USIdescription  The project involved analysing historic deals and coming with insights to optimize future dealsRole Was given raw data carried out end to end analysis and presented insights to clientKey Responsibilities Extract data from client systems across geographies Understand and build reports in tableau Infer meaningful insights to optimize prices and find out process blockadesTechnical Environment R TableauIndustry Cross IndustryService Area Cross Industry  ProductsProject Name Handwriting recognitionConsultant 3 monthsThe project involved taking handwritten images and converting them to digital text images by object detection and sentence creationRole I was developing sentence correction functionalityKey Responsibilities Gather data large enough to capture all English words Train LSTM models on wordsTechnical Environment PythonIndustry FinanceService Area Financial Services  BI development Project Name SWIFTConsultant 8 monthsThe project was to develop an analytics infrastructure on top of SAP S4 it would user to viewfinancial reports to respective departments Reporting also included forecasting expensesRole I was leading the offshore teamKey Responsibilities Design  Develop data models for reporting Develop ETL for data flow Validate various reportsTechnical Environment SAP HANA Tableau SAP AOIndustry Healthcare AnalyticsService Area Life Sciences  Product development Project Name Clinical Healthcare SystemConsultant 2 monthsThe project was to develop an analytics infrastructure on top of Argus it would allow users to query faster and provide advance analytics capabilitiesRole I was involved from design to deploy phase performed a lot of data restructuring and builtmodels for insightsKey Responsibilities Design  Develop data models for reporting Develop and deploy analytical models Validate various reportsTechnical Environment Data Modelling SAP HANA Tableau NLPIndustry FMCGService Area Trade  PromotionProject Name Consumption Based Planning for Flowers Foods Consultant 8 monthsThe project involved setting up of CRM and CBP modulesRole I was involved in key data decomposition activities and setting up the base for future yearforecast Over the course of the project I developed various models and carried out keyperformance improvementsKey Responsibilities Design  Develop HANA models for decomposition Develop data flow for forecast Developed various views for reporting of CustomerSalesFunds Validate various reports in BOBJTechnical Environment Data Modelling SAP HANA BOBJ Time Series ForecastingInternal Initiative Industry FMCGCustomer Segmentation and RFM analysis Consultant 3 monthsThe initiative involved setting up of HANAPython interface and advance analytics on Python Over the course I had successfully segmented data into five core segments using Kmeans and carried out RFM analysis in Python Also developed algorithm to categorize any new customer under the defined bucketsTechnical Environment Anaconda3 Python36 HANA SPS12Industry Telecom Invoice state detection Consultant 1 monthsThe initiative was to reduce the manual effort in verifying closed and open invoices manually itinvolved development to a decision tree to classify openclosed invoices This enabled effortreduction by 60Technical Environment R SAP PAL SAP HANA SPS12Accenture ExperienceIndustry Analytics  Cross IndustryIn Process Analytics for SAP Senior Developer 19 monthsAccenture Solutions Pvt Ltd IndiaThe project involved development of SAP analytics tool  In Process Analytics IPA  My role was to develop database objects and data models to provide operational insights to clientsRole I have developed various Finance related KPIs and spearheaded various deploymentsIntroduced SAP Predictive analytics to reduce development time and reuse functionalities for KPIs and prepared production planning reportsKey Responsibilities Involved in information gather phase Designed and implemented SAP HANA data modelling using Attribute View Analytic View andCalculation View Developed various KPIs individually using complex SQL scripts in Calculation views Created procedures in HANA Database Took ownership and developed Dashboard functionality Involved in building data processing algorithms to be executed in R server for cluster analysisTechnical Environment R SAP HANA TSQLIndustry Cross IndustryAccenture Testing Accelerator for SAP Database Developer 21 monthsAccenture Solutions Pvt Ltd IndiaRole I have taken care of all development activities for the ATAS tool and have also completedvarious deployments of the productApart from these activities I was also actively involved in maintenance of the database serversProduction  QualityKey Responsibilities Analyzing business requirements understanding the scope getting requirements clarifiedinteracting with business and further transform all requirements to generate attributemapping documents and reviewing mapping specification documentation Create  Update database objects like tables views stored procedures function and packages Monitored SQL Server Error Logs and Application Logs through SQL Server Agent Prepared Data Flow Diagrams Entity Relationship Diagrams using UML Responsible for Designing developing and Normalization of database tables Experience in performance tuning using SQL profiler Involved in QA UAT knowledge transfer and support activitiesTechnical Environment SQL Server 20082014 Visual Studio 2010 Windows Server PerformanceMonitor SQL Server Profiler C PLSQL TSQL,Data Science,tech_resumes1_csv
27,Education Details  BTech   Rayat and Bahra Institute of Engineering and BiotechnologyData Science Data ScienceSkill Details Numpy Exprience  Less than 1 year monthsMachine Learning Exprience  Less than 1 year monthsTensorflow Exprience  Less than 1 year monthsScikit Exprience  Less than 1 year monthsPython Exprience  Less than 1 year monthsGCP Exprience  Less than 1 year monthsPandas Exprience  Less than 1 year monthsNeural Network Exprience  Less than 1 year monthsCompany Details company  Wiprodescription  Bhawana AggarwalEMailbhawanachdgmailcomPhone 09876971076VVersatile highenergy professional targeting challenging assignments in MachinePROFILE SUMMARY An IT professional with knowledge and experience of 2 years in Wipro Technologies in MachineLearning Deep Learning Data Science Python Software Development Skilled in managing endtoend development and software products  projects from inception requirementspecs planning designing implementation configuration and documentation Knowledge on Python  Machine Learning Deep Learning data Science Algorithms Neural NetworkNLP GCP Knowledge on Python Libraries like Numpy Pandas Seaborn  Matplotlib Cufflinks Knowledge on different algorithms in Machine learning like KNN Decision Tree Bias variance Trade offSupport vector MachineSVMLogistic Regression Neural networks Have knowledge on unsupervised Supervised and reinforcement data Programming experience in relational platforms like MySQLOracle Have knowledge on Some programming language like CJava Experience in cloud based environment like Google Cloud Working on different Operating System like Linux Ubuntu Windows Good interpersonal and communication skills Problem solving skills with the ability to think laterally and to think with a medium term and long termperspective Flexibility and an open attitude to change Ability to create define and own frameworks with a strong emphasis on code reusabilityTECHNICAL SKILLSProgramming Languages Python CLibraries Seaborn Numpy Pandas Cufflinks MatplotlibAlgorithmsKNN Decision Tree Linear regression Logistic Regression Neural Networks K means clusteringTensorflow SVMDatabases SQL OracleOperating Systems Linux WindowDevelopment Environments NetBeans Notebooks SublimeTicketing tools Service Now RemedyEducationUG EducationBTech Computer Science from Rayat and Bahra Institute of Engineering and Biotechnology passed with 784in2016SchoolingXII in 2012 from Moti Ram Arya Sr Secondary SchoolPassed with 784X in 2010 from Valley Public School Passed with 94 CGPAWORK EXPERINCETitle  Wipro Neural Intelligence PlatformTeam Size  5Brief Wipros Neural Intelligence Platform harnesses the power of automation and artificial intelligencetechnologiesnatural language processing NLP cognitive machine learning and analytics The platformcomprises three layers a data engagement platform that can easily access and manage multiple structured andunstructured data sources an intent assessment and reasoning engine that includes sentiment and predictiveanalytics and a deep machine learning engine that can sense act and learn over time The project entailedautomating responses to user queries at the earliest The Monster Bot using the power of Deep Machine LearningNLP to handle such queries User can see the how their queries can be answered quickly like allL1 activities can beeliminatedEntity Extractor  This involves text extraction and NLP for fetching out important information from the text likedates names places contact numbers etc This involves Regex Bluemix NLU apis and machine learning usingTensor flow for further learning of new entitiesClassifier This involves the classifications of classes training of dataset and predicting the output using the SKLearnclassifier MNB SVM SGD as Classifier and SGD for the optimization to map the user queries with the bestsuited response and make the system efficientNER A Deep Learning NER Model is trained to extract the entities from the text Entities like Roles SkillsOrganizations can be extracted from raw text RNNLSTM Bidirectional model is trained for extracting such entitiesusing Keras TensorFlow frameworkOTHER PROJECTSTitle  Diabetes DetectionBrief  Developed the software which can detect whether the person is suffering from Diabetes or not and got the thirdprize in itTRAINING AND CERTIFICATIONSTitle Python Training Machine Learning Data Science Deep LearningOrganization Udemy Coursera Machine Learning Deep LearningPersonal ProfileFathers Name Mr Tirlok AggarwalLanguage Known  English  HindiMarital Status SingleDate of BirthGender19931220YYYYMMDD Fcompany  Wiprodescription  Developing programs in Pythoncompany  Wiprodescription  Title  Wipro Neural Intelligence PlatformTeam Size  5Brief Wipros Neural Intelligence Platform harnesses the power of automation and artificial intelligencetechnologiesnatural language processing NLP cognitive machine learning and analytics The platformcomprises three layers a data engagement platform that can easily access and manage multiple structured andunstructured data sources an intent assessment and reasoning engine that includes sentiment and predictiveanalytics and a deep machine learning engine that can sense act and learn over time The project entailedautomating responses to user queries at the earliest The Monster Bot using the power of Deep Machine LearningNLP to handle such queries User can see the how their queries can be answered quickly like allL1 activities can beeliminatedEntity Extractor  This involves text extraction and NLP for fetching out important information from the text likedates names places contact numbers etc This involves Regex Bluemix NLU apis and machine learning usingTensor flow for further learning of new entitiesClassifier This involves the classifications of classes training of dataset and predicting the output using the SKLearnclassifier MNB SVM SGD as Classifier and SGD for the optimization to map the user queries with the bestsuited response and make the system efficientNER A Deep Learning NER Model is trained to extract the entities from the text Entities like Roles SkillsOrganizations can be extracted from raw text RNNLSTM Bidirectional model is trained for extracting such entitiesusing Keras TensorFlow frameworkcompany  Wipro Technologiesdescription  An IT professional with knowledge and experience of 2 years in Wipro Technologies in MachineLearning Deep Learning Data Science Python Software Development Skilled in managing endtoend development and software products  projects from inception requirementspecs planning designing implementation configuration and documentation Knowledge on Python  Machine Learning Deep Learning data Science Algorithms Neural NetworkNLP GCP Knowledge on Python Libraries like Numpy Pandas Seaborn  Matplotlib Cufflinks Knowledge on different algorithms in Machine learning like KNN Decision Tree Bias variance Trade offSupport vector MachineSVMLogistic Regression Neural networks Have knowledge on unsupervised Supervised and reinforcement data Programming experience in relational platforms like MySQLOracle Have knowledge on Some programming language like CJava Experience in cloud based environment like Google Cloud Working on different Operating System like Linux Ubuntu Windows Good interpersonal and communication skills Problem solving skills with the ability to think laterally and to think with a medium term and long termperspective Flexibility and an open attitude to change Ability to create define and own frameworks with a strong emphasis on code reusability,Data Science,tech_resumes1_csv
19,Expertise  Data and Quantitative Analysis  Decision Analytics  Predictive Modeling  DataDriven Personalization  KPI Dashboards  Big Data Queries and Interpretation  Data Mining and Visualization Tools  Machine Learning Algorithms  Business Intelligence BI  Research Reports and Forecasts Education Details  PGP in Data Science  Mumbai Maharashtra Aegis School of data science  Business BE in Electronics  Communication Electronics  Communication Indore Madhya Pradesh IES IPS AcademyData Scientist Data Scientist with PR CanadaSkill Details Algorithms Exprience  6 monthsBI Exprience  6 monthsBusiness Intelligence Exprience  6 monthsMachine Learning Exprience  24 monthsVisualization Exprience  24 monthsspark Exprience  24 monthspython Exprience  36 monthstableau Exprience  36 monthsData Analysis Exprience  24 monthsCompany Details company  Aegis school of Data Science  Businessdescription  Mostly working on industry project for providing solution along with Teaching Appointments Teach undergraduate and graduatelevel courses in Spark and Machine Learning as an adjunct faculty member at Aegis School of Data Science Mumbai 2017 to Presentcompany  Aegis school of Data  Businessdescription  Data Science Intern Nov 2015 to Jan 2016Furnish executive leadership team with insights analytics reports and recommendations enabling effective strategic planning across all business units distribution channels and product lines Chat Bot using AWS LEX and Tensor flow  PythonThe goal of project creates a chat bot for an academic institution or university to handle queries related courses offered by that institute The objective of this task is to reduce human efforts as well as reduce man made errors Even by this companies handle their client 24x7 In this case companies are academic institutions and clients are participants or students Web scraping using Selenium web driver   PythonThe task is to scrap the data from the online messaging portal in a text format and have to find the pattern form it Data Visualization and Data insights   Hadoop Eco System Hive PySpark QlikSenseThe goal of this project is to build a Business Solutions to a Internet Service Provider Company like handling data which is generated per day basis for that we have to visualize that data and find the usage pattern form it and have a generate a reports Image Based Fraud Detection   Microsoft Face API PySpark Open CVThe main goal of project is Recognize similarity for a face to given Database images Face recognition is the recognizing a special face from set of different faces Face is extracted and then compared with the database Image if that Image recognized then the person already applied for loan from somewhere else and now hiding his or her identity this is how we are going to prevent the frauds in the initial stage itself Churn Analysis for Internet Service Provider   R Python Machine Learning HadoopThe objective is to identify the customer who is likely to churn in a given period of time we have to pretend the customer giving incentive offers Sentiment Analysis   Python NLP Apache Spark service in IBM BluemixThis project is highly emphasis on tweets from Twitter data were taken for mobile networks service provider to do a sentiment analysis and analyze whether the expressed opinion was positive negative or neutral capture the emotions of the tweets and comparative analysisQuantifiable Results Mentored 712 Data Science Enthusiast each year that have all since gone on to graduate school in Data Science and Business Analytics Reviewed and evaluated 2040 Research Papers on Data Science for one of the largest Data Science Conference called Data Science Congress by Aegis School of Business Mumbai Heading a solution providing organization called Data Science Delivered into Aegis school of Data Science Mumbai and managed 45 live projects using Data Science techniques Working for some social cause with the help of Data Science for Social Goods Committee where our team developed a product called Lets find a missing Child for helping societycompany  IBM India pvt ltddescription  Mostly worked on blumix and IBM Watson for Data science,Data Science,tech_resumes1_csv
24,Education Details  MCA   YMCAUST  Faridabad  HaryanaData Science internship Skill Details Data Structure Exprience  Less than 1 year monthsC Exprience  Less than 1 year monthsData Analysis Exprience  Less than 1 year monthsPython Exprience  Less than 1 year monthsCore Java Exprience  Less than 1 year monthsDatabase Management Exprience  Less than 1 year monthsCompany Details company  Itechpowerdescription,Data Science,tech_resumes1_csv
